{
  "$schema": "http://json-schema.org/draft-07/schema#",
  "title": "MCP Asset Schema",
  "$ref": "#/definitions/MCPServer",
  "definitions": {
    "@context": {
      "@type": [
        "http://anypoint.com/vocabs/mcp#Server"
      ]
    },
    "MCPServer": {
      "type": "object",
      "required": [
        "transport"
      ],
      "properties": {
        "description": {
          "type": "string",
          "description": "A human-readable description of the server."
        },
        "protocolVersion": {
          "type": "string",
          "enum": [
            "2024-11-05",
            "2025-03-26"
          ],
          "description": "The version of the protocol being used. This is used to determine the structure and capabilities of the data."
        },
        "introspectedAt": {
          "type": "string",
          "description": "Timestamp when the introspection was performed"
        },
        "connectionStatus": {
          "type": "string",
          "description": "Status of the connection to the MCP server",
          "enum": [
            "success",
            "failed",
            "error"
          ]
        },
        "transport": {
          "$ref": "#/definitions/MCPTransport",
          "description": "The transport protocol used for communication. This defines how the data is transmitted between the client and server."
        },
        "capabilities": {
          "type": "object",
          "description": "Boolean flags indicating which capabilities the server supports",
          "required": [
            "tools",
            "resources",
            "prompts",
            "logging"
          ],
          "properties": {
            "tools": {
              "type": "boolean",
              "description": "Whether the server supports tools"
            },
            "resources": {
              "type": "boolean",
              "description": "Whether the server supports resources"
            },
            "prompts": {
              "type": "boolean",
              "description": "Whether the server supports prompts"
            },
            "logging": {
              "type": "boolean",
              "description": "Whether the server supports logging"
            }
          },
          "additionalProperties": false
        },
        "logging": {
          "type": "object",
          "properties": {},
          "description": "Present if the server supports sending log messages to the client.",
          "additionalProperties": true
        },
        "tools": {
          "type": "array",
          "items": {
            "$ref": "#/definitions/Tool"
          },
          "description": "A list of tools available in the mcp api. Each tool has a name, description, and input schema that defines the expected input format."
        },
        "resources": {
          "type": "array",
          "items": {
            "$ref": "#/definitions/Resource"
          },
          "description": "A list of resources available in the mcp api. Each resource has a URI, name, description, MIME type, and annotations that provide additional metadata."
        },
        "prompts": {
          "type": "array",
          "items": {
            "$ref": "#/definitions/Prompt"
          },
          "description": "A list of prompts available in the mcp api. Each prompt has a name, description, and arguments that define the expected input format for the prompt."
        },
        "additionalProperties": false
      }
    },
    "SseTransport": {
      "@context": {
        "@type": [
          "http://anypoint.com/vocabs/mcp#Transport",
          "http://anypoint.com/vocabs/mcp#SseTransport"
        ],
        "@base": "http://anypoint.com/vocabs/mcp#"
      },
      "required": [
        "kind",
        "ssePath"
      ],
      "properties": {
        "kind": {
          "type": "string",
          "const": "sse"
        },
        "ssePath": {
          "type": "string",
          "description": "Path to the SSE endpoint"
        },
        "messagesPath": {
          "type": "string",
          "description": "Path to the messages endpoint"
        }
      },
      "additionalProperties": false
    },
    "StreamableHttpTransport": {
      "@context": {
        "@type": [
          "http://anypoint.com/vocabs/mcp#Transport",
          "http://anypoint.com/vocabs/mcp#StreamableHttpTransport"
        ],
        "@base": "http://anypoint.com/vocabs/agents#"
      },
      "required": [
        "kind"
      ],
      "properties": {
        "kind": {
          "type": "string",
          "const": "streamableHttp"
        },
        "path": {
          "type": "string",
          "description": "Path to the mcp endpoint"
        }
      },
      "additionalProperties": false
    },
    "MCPTransport": {
      "type": "object",
      "oneOf": [
        {
          "$ref": "#/definitions/SseTransport"
        },
        {
          "$ref": "#/definitions/StreamableHttpTransport"
        }
      ]
    },
    "Tool": {
      "@context": {
        "@type": [
          "http://anypoint.com/vocabs/mcp#Tool"
        ]
      },
      "description": "Definition for a tool the client can call.",
      "properties": {
        "annotations": {
          "$ref": "#/definitions/ToolAnnotations",
          "description": "Optional additional tool information."
        },
        "description": {
          "description": "A human-readable description of the tool.\n\nThis can be used by clients to improve the LLM's understanding of available tools. It can be thought of like a \"hint\" to the model.",
          "type": "string"
        },
        "inputSchema": {
          "@context": {
            "@type": [
              "http://anypoint.com/vocabs/mcp#ToolInputSchema"
            ]
          },
          "description": "A JSON Schema object defining the expected parameters for the tool.",
          "properties": {
            "properties": {
              "additionalProperties": {
                "additionalProperties": true,
                "properties": {},
                "type": "object"
              },
              "type": "object"
            },
            "required": {
              "items": {
                "type": "string"
              },
              "type": "array"
            },
            "type": {
              "const": "object",
              "type": "string"
            }
          },
          "required": [
            "type"
          ],
          "type": "object"
        },
        "name": {
          "description": "The name of the tool.",
          "type": "string"
        }
      },
      "required": [
        "inputSchema",
        "name"
      ],
      "type": "object"
    },
    "ToolAnnotations": {
      "description": "Additional properties describing a Tool to clients.\n\nNOTE: all properties in ToolAnnotations are **hints**.\nThey are not guaranteed to provide a faithful description of\ntool behavior (including descriptive properties like `title`).\n\nClients should never make tool use decisions based on ToolAnnotations\nreceived from untrusted servers.",
      "properties": {
        "destructiveHint": {
          "description": "If true, the tool may perform destructive updates to its environment.\nIf false, the tool performs only additive updates.\n\n(This property is meaningful only when `readOnlyHint == false`)\n\nDefault: true",
          "type": "boolean"
        },
        "idempotentHint": {
          "description": "If true, calling the tool repeatedly with the same arguments\nwill have no additional effect on the its environment.\n\n(This property is meaningful only when `readOnlyHint == false`)\n\nDefault: false",
          "type": "boolean"
        },
        "openWorldHint": {
          "description": "If true, this tool may interact with an \"open world\" of external\nentities. If false, the tool's domain of interaction is closed.\nFor example, the world of a web search tool is open, whereas that\nof a memory tool is not.\n\nDefault: true",
          "type": "boolean"
        },
        "readOnlyHint": {
          "description": "If true, the tool does not modify its environment.\n\nDefault: false",
          "type": "boolean"
        },
        "title": {
          "description": "A human-readable title for the tool.",
          "type": "string"
        }
      },
      "type": "object"
    },
    "Prompt": {
      "@context": {
        "@type": [
          "http://anypoint.com/vocabs/mcp#Prompt"
        ]
      },
      "description": "A prompt or prompt template that the server offers.",
      "properties": {
        "arguments": {
          "description": "A list of arguments to use for templating the prompt.",
          "items": {
            "$ref": "#/definitions/PromptArgument"
          },
          "type": "array"
        },
        "description": {
          "description": "An optional description of what this prompt provides",
          "type": "string"
        },
        "name": {
          "description": "The name of the prompt or prompt template.",
          "type": "string"
        }
      },
      "required": [
        "name"
      ],
      "type": "object"
    },
    "PromptArgument": {
      "@context": {
        "@type": [
          "http://anypoint.com/vocabs/mcp#PromptArgument"
        ]
      },
      "description": "Describes an argument that a prompt can accept.",
      "properties": {
        "description": {
          "description": "A human-readable description of the argument.",
          "type": "string"
        },
        "name": {
          "description": "The name of the argument.",
          "type": "string"
        },
        "required": {
          "description": "Whether this argument must be provided.",
          "type": "boolean"
        }
      },
      "required": [
        "name"
      ],
      "type": "object"
    },
    "Resource": {
      "@context": {
        "@type": [
          "http://anypoint.com/vocabs/mcp#Resource"
        ]
      },
      "description": "A known resource that the server is capable of reading.",
      "properties": {
        "annotations": {
          "$ref": "#/definitions/Annotations",
          "description": "Optional annotations for the client."
        },
        "description": {
          "description": "A description of what this resource represents.\n\nThis can be used by clients to improve the LLM's understanding of available resources. It can be thought of like a \"hint\" to the model.",
          "type": "string"
        },
        "mimeType": {
          "description": "The MIME type of this resource, if known.",
          "type": "string"
        },
        "name": {
          "description": "A human-readable name for this resource.\n\nThis can be used by clients to populate UI elements.",
          "type": "string"
        },
        "size": {
          "description": "The size of the raw resource content, in bytes (i.e., before base64 encoding or any tokenization), if known.\n\nThis can be used by Hosts to display file sizes and estimate context window usage.",
          "type": "integer"
        },
        "uri": {
          "description": "The URI of this resource.",
          "format": "uri",
          "type": "string"
        }
      },
      "required": [
        "name",
        "uri"
      ],
      "type": "object"
    },
    "Annotations": {
      "description": "Optional annotations for the client. The client can use annotations to inform how objects are used or displayed",
      "properties": {
        "audience": {
          "description": "Describes who the intended customer of this object or data is.\n\nIt can include multiple entries to indicate content useful for multiple audiences (e.g., `[\"user\", \"assistant\"]`).",
          "items": {
            "$ref": "#/definitions/Role"
          },
          "type": "array"
        },
        "priority": {
          "description": "Describes how important this data is for operating the server.\n\nA value of 1 means \"most important,\" and indicates that the data is\neffectively required, while 0 means \"least important,\" and indicates that\nthe data is entirely optional.",
          "maximum": 1,
          "minimum": 0,
          "type": "number"
        }
      },
      "type": "object"
    },
    "Role": {
      "description": "The sender or recipient of messages and data in a conversation.",
      "enum": [
        "assistant",
        "user"
      ],
      "type": "string"
    }
  }
}
